post_title,sku,short_descripcion,description,regular_price,sale_price,product_cat,images
"Apple - iPad Pro Wi- FI 256 GB 11"", Plata",HA47,"El increíble iPad Pro de 11 "" integra una avanzada pantalla Liquid Retina que va de borde a borde”. Face ID, para que puedas desbloquear de forma segura el iPad Pro, inicia sesión en tus apps y pagar con solo una mirada. El chip A12X Bionic es más rápido que muchas laptops y ejecutan fácilmente apps profesionales. Vida útil de la batería durante todo el día. Wi-Fi. Más de un millón de apps disponibles en la App Store, incluidas experiencias de realidad aumentada. Y el nuevo Apple Pencil y Smart Keyboard Folio te ayudan a ser aún más creativo y productivo.","Potente y eficiente

Con una arquitectura de 64 bits, un diseño de 4 núcleos y más de 3,300 millones de transistores, el iPad es increíblemente rápido. Toda esa potencia te permite editar un video 4K, divertirte con juegos de gráficos avanzados y disfrutar las últimas apps de VR.
Pantalla Liquid Retina. Tan espectacular como práctica

Te brinda una experiencia envolvente en todo lo que haces con el iPad.

Ya sea que estés armando un plan de negocios como pintando una obra maestra, la intensidad y claridad de la amplia pantalla es tan cautivadora que te darán ganas de tocarla. Por suerte, puedes hacerlo con toda tranquilidad.
Si tu iPad es multitasking, tú también

El poder del iPad te permite usar varias apps a la vez. Por ejemplo, puedes trabajar en un plan de negocios, navegar por Internet y llamar por FaceTime al mismo tiempo. Ser multitasking con el iPad es más fácil de lo que te imaginas.
La forma más envolvente de disfrutar la realidad aumentada

AR es una nueva tecnología que le da vida a objetos virtuales.

El iPad es ideal para disfrutarla porque muchas de sus características, como la pantalla RETINA, la potencia de procesamiento y los sensores de movimiento, fueron diseñadas especialmente para que la magia de las apps de AR sea más asombrosa que nunca.
Guarda en el iPad lo que está en tu cabeza

El iPad es siempre una gran herramienta para concretar tus ideas, y ahora te ofrece una nueva forma de hacerlas realidad.

El Apple Pencil te permite escribir notas, pintar con acuarelas o firmar un contrato con una precisión increíble y una gran velocidad de respuesta. Se siente tan natural como usar un lápiz, pero te brinda miles de posibilidades más.
Cámaras Multitasking

A las cámaras frontal y trasera también les encanta hacer muchas cosas: toman fotos increíbles y videos de gran calidad, escanean documentos, hacen llamadas FaceTime e incluso permiten diseñar un plano con realidad aumentada.
Teclado Bluetooth a tu talento para escribir

¿Necesitas escribir un trabajo de investigación, un email o el guión de una película? No hay problema. El iPad no sólo tiene un intuitivo teclado en pantalla, sino que también es compatible con cualquier teclado Bluetooth.
Lleno de poderosas apps integradas

Mezcla una canción con GarageBand, crea una presentación impactante en Keynote, o filma y edita un cortometraje con iMovie. El iPad incluye un conjunto de apps de Apple que están listas para trabajar con tu creatividad.
Delgado, ligero y resistente

Menos de 500 gramos de peso, 7.5 milímetros de grosor y un diseño resistente para que puedas llevarlo adonde quieras. Y adonde lo lleves, podrás lucirlo.
La mejor conexión

El iPad fue diseñado para que te mantengas conectado dondequiera que vayas.
Batería para todo el día

10 horas de batería en una sola carga. Con esta duración de la batería, el iPad te brinda más tiempo para navegar, escribir, dibujar, trabajar, comprar y todo lo que necesites hacer.
Si sabes deslizar un dedo, pellizcar y tocar, ya sabes usarlo

El iPad fue creado para usarse de manera intuitiva, incluso para los que no lo han usado antes. Los gestos Multi-Touch permiten buscar fotos, editar documentos y organizar archivos con sólo tocar la espectacular pantalla.",23599,22499,Teléfonos y comunicaciones,"https://pisces.bbystatic.com/image2/BestBuy_MX/images/products/1000/1000216185cv11a.jpg,https://pisces.bbystatic.com/image2/BestBuy_MX/images/products/1000/1000216185cv12a.jpg,https://pisces.bbystatic.com/image2/BestBuy_MX/images/products/1000/1000216185cv13a.jpg,https://pisces.bbystatic.com/image2/BestBuy_MX/images/products/1000/1000216185cv14a.jpg"
"Lenovo - Tablet Yoga 10"" TAB 3 Proyector, Negro",HA48,Arriba el telón y disfruta del entretenimiento como nunca con la primer Tableta del mundo con proyector incorporado. Transforma cualquier pared o techo en una súper pantalla brillante de 70” y vive una experiencia de cine en casa. Comparta con amigos en una pantalla QHD de 10.1” y un audio sorprendente de 4 bocinas JBL integrado. Con hasta 18 horas de batería en una sola carga.,"Imágenes sorprendentes.

La pantalla QHD es perfecta para sumergirte en los juegos y en videos. También ofrece imágenes brillantes y nítidas.
Con tecnología Anypen.

La tecnología Lenovo AnyPen detecta cualquier objeto conductivo como si fuera un lápiz.  Eso es útil cuando estás usando tu tablet para tomar notas, dibujar..
Proyector integrado que rota.

Con proyector integrado que convierte cualquier habitación en tu propio cine. Utiliza la bisagra rotativa y un súper brillo de 50 lúmenes para proyectar una imagen hasta 70"" en cualquier pared.
Sonido envolvente.

Con excelente sonido tipo Home Theater que no podrás experimentar en ninguna otra tablet.  Los cuatro parlantes JBL integrados con orientación frontal.",13299,12499,Teléfonos y comunicaciones,"https://pisces.bbystatic.com/image2/BestBuy_MX/images/products/1000/1000204236cv11d.jpg,https://pisces.bbystatic.com/image2/BestBuy_MX/images/products/1000/1000204236cv12d.jpg,https://pisces.bbystatic.com/image2/BestBuy_MX/images/products/1000/1000204236cv13d.jpg,https://pisces.bbystatic.com/image2/BestBuy_MX/images/products/1000/1000204236cv14d.jpg"
"Lenovo - Yoga Tab 3 8"" 850F - Negro",HA49,"El Tab3 850 te ofrece en un equipo de 8'' una magnifica movilidad junto con unas especificaciones increibles asi como unas perfectas características multimedia, como su cámara de 8 MP, memoria interna de 16 GB, RAM de 2 GB y sistema operativo Android 5.1.","Pantalla de 8""

Con la pantalla de 8"" visualizarás todas tus imágenes y fotos
Cámara de 8 MP

Captura tus mejores momentos con su cámara trasera de 8 megapíxeles para grandes fotos.
Sistema Operativo Android 5.1

Este es un sistema Operativo increíble que ayuda a que este equipo tenga el mejor rendimiento.
Almacenamiento de 16 GB

Para que puedas guardar tus fotos, música, juegos y documentos.",5299,4599,Teléfonos y comunicaciones,"https://pisces.bbystatic.com/image2/BestBuy_MX/images/products/1000/1000207660cv11d.jpg,https://pisces.bbystatic.com/image2/BestBuy_MX/images/products/1000/1000207660cv12d.jpg,https://pisces.bbystatic.com/image2/BestBuy_MX/images/products/1000/1000207660cv13d.jpg,https://pisces.bbystatic.com/image2/BestBuy_MX/images/products/1000/1000207660cv15d.jpg"
"Huawei - Tab Media Pad T5 10.1"" - Negra",HA50,"Con un diseño ligero y una pantalla Vivid HD Full HD de 10.1"". Con un diseño premium y refinado. Su cuerpo de metal simétrico está hecho con cuidado y es elegante y liviano (aproximadamente 460 g), lo suficiente como para ser convenientemente portátil y fácil de sostener.","Huawei MediaPad T5

Disfruta de todas las caraterísticas que te ofrece la tablet de Huawei Media Pad T5.
Diseño ligero

Llévala siempre contigo gracias a su diseño liviano.
Pantalla Vivid HD Full HD de 10.1""

Con un diseño premium y refinado. Su cuerpo de metal simétrico está hecho con cuidado y es elegante y liviano (aproximadamente 460 g), lo suficiente como para ser convenientemente portátil y fácil de sostener.
Impresionante pantalla Full HD de 1080p

Con una pantalla de 10.1"" y una resolución 1920 X 1200 que brinda excelentes detalles. La relación de aspecto 16:10 lo hace perfecto para ver películas o programas de televisión y navegar por sitios web.
Procesador potente, rendimiento abrasador

El procesador Octa - Core con una frecuencia principal de hasta 2.36 GHz te brinda un gran rendimiento y consume menos energía.
Android rápido e intuitivo 8.0

br>Basado en Android 8.0, EMUI 8.0 está diseñado meticulosamente para una experiencia de usuario más suave, más inteligente e intuitiva. Sus aplicaciones se cargan más rápido y se ejecutan sin pausas inexplicables.
Altavoces duales, sonido inmersivo

Los altavoces duales producen audio robusto de alta calidad para su música favorita. La tecnología de audio HUAWEI Histen hace que el sonido sea más rico, brindándole una experiencia cinematográfica inmersiva.
Cuida tus ojos

El modo de comodidad visual reduce la luz azul dañina para crear condiciones de lectura saludables para usted y su familia.
Un rincón para los niños

Children's Corner ofrece un lugar divertido para que los niños jueguen y aprendan con muchas aplicaciones especialmente diseñadas.

Administra fácilmente las aplicaciones que sus hijos pueden usar y cuánto tiempo pasan en la tableta personalizando la configuración de acceso para sus pequeños.",5499,4499,Teléfonos y comunicaciones,"https://pisces.bbystatic.com/image2/BestBuy_MX/images/products/1000/1000217092cv11a.jpg,https://pisces.bbystatic.com/image2/BestBuy_MX/images/products/1000/1000217092cv12a.jpg,https://pisces.bbystatic.com/image2/BestBuy_MX/images/products/1000/1000217092cv13a.jpg,https://pisces.bbystatic.com/image2/BestBuy_MX/images/products/1000/1000217092cv14a.jpg"
